{
    "key": "session--evaluation",
    "title": "Session Evaluation",
    "fields": [
        {
            "key": "session--evaluable",
            "name": "evaluable",
            "label": "Evaluable",
            "instructions": "Does this session have a dedicated evaluation?",
            "type": "true_false",
            "required": 0,
            "conditional_logic": 0,
            "wrapper": {
                "width": "",
                "class": "",
                "id": ""
            },
            "message": "",
            "default_value": 0,
            "ui": 1,
            "ui_on_text": "",
            "ui_off_text": ""
        }
    ],
    "location": [
        [
            {
                "param": "post_type",
                "operator": "==",
                "value": "session"
            }
        ]
    ],
    "menu_order": 30,
    "position": "side",
    "style": "default",
    "label_placement": "top",
    "instruction_placement": "label",
    "hide_on_screen": "",
    "active": 1,
    "description": "",
    "private": 1
}
